<?xml version="1.0" encoding="UTF-8" standalone="no" ?>
<c_mapObjects xmlns:xsi="http://www.w3.org/2001/XMLSchema-instance" xsi:noNamespaceSchemaLocation="mapObjects.xsd">
	<object class="class_placeholder" id="1" healthperc="100" player="1" x="100" y="200" name="ciao" icon="ciao"/>
    <object class="class_placeholder" id="2" healthperc="100" player="2" x="100" y="200" name="ciao" icon="ciao" />
	<settlement class="RTownhall" id="3" player="1" x="100" y="200" name="ciao" gold="100" food="100" population="100" maxpopulation="200" healthperc="100" icon="ciao">
        <object class="class_placeholder" id="4" healthperc="100" player="1" x="100" y="200" icon="ciao" />
        <object class="class_placeholder" id="5" healthperc="100" player="1" x="100" y="200" icon="ciao" />
    </settlement>
    <settlement class="RTownhall" id="6" player="1" x="100" y="200" name="ciao" gold="100" food="100" population="100" maxpopulation="200" healthperc="100" icon="ciao">
        <object class="class_placeholder" id="7" healthperc="100" player="1" x="100" y="200" icon="ciao" />
        <object class="class_placeholder" id="8" healthperc="100" player="1" x="100" y="200" icon="ciao" />
    </settlement>
</c_mapObjects>